{
  "contract": "transformer-flight",
  "version": 7,
  "requestId": "77777777-7777-4777-8777-777777777777",
  "idempotencyKey": "inventory-input-close-20260810-1",
  "jobId": "33333333-3333-4333-8333-333333333333",
  "clientExecutionId": "56565656-5656-4565-8565-565656565656",
  "fencingToken": "2",
  "payloadCount": 1,
  "totalRows": 3,
  "totalBytes": 1290,
  "manifestSha256": "c02a01bfafab05f7c634bac55d4bc98f7057aad52ee89887e768b813ba686a86"
}
